[
  {
    "slug": "evergreen-bank-premier-checking-300-example",
    "title": "Premier Checking $300 Offer",
    "provider": "Evergreen Bank",
    "category": "bank-bonuses",
    "offerAmount": "$300",
    "offerType": "Checking bonus",
    "description": "Tracked offer for opening a new checking account and completing qualifying direct deposits. Terms may change and availability can vary by user, state, and account type.",
    "requirements": [
      "Open an eligible new checking account.",
      "Complete qualifying direct deposits within the stated offer window.",
      "Keep the account open and in good standing until the bonus posts."
    ],
    "fees": [
      "Monthly service fee may apply unless waiver requirements are met."
    ],
    "expirationDate": "2026-08-31",
    "sourceUrl": "https://example.com/evergreen-premier-checking",
    "lastVerified": "2026-06-01",
    "verificationStatus": "verified_today",
    "status": "active",
    "featured": true,
    "requiresDirectDeposit": true,
    "minimumDeposit": "$1,000 in qualifying direct deposits",
    "monthlyFee": "$12, waivable",
    "riskNotes": [
      "Confirm direct deposit definitions and bonus payout timing."
    ],
    "tags": [
      "checking",
      "direct deposit"
    ],
    "lastChanged": "2026-06-01"
  },
  {
    "slug": "harbor-one-checking-200-example",
    "title": "Everyday Checking $200 Bonus",
    "provider": "Harbor One Bank",
    "category": "bank-bonuses",
    "offerAmount": "$200",
    "offerType": "Checking bonus",
    "description": "Tracked offer for new checking customers who complete qualifying account activity. Verify the current offer with the provider before opening an account.",
    "requirements": [
      "Open a new eligible checking account.",
      "Receive qualifying deposits during the first 90 days.",
      "Maintain account eligibility through the bonus review period."
    ],
    "fees": [
      "Overdraft and account maintenance fees may apply."
    ],
    "expirationDate": "2026-07-15",
    "sourceUrl": "https://example.com/harbor-one-checking",
    "lastVerified": "2026-05-31",
    "verificationStatus": "verified_this_week",
    "status": "active",
    "requiresDirectDeposit": true,
    "minimumDeposit": "$500 in qualifying deposits",
    "monthlyFee": "$10, waivable",
    "stateRestrictions": [
      "Availability may vary by state."
    ],
    "riskNotes": [
      "Regional restrictions may apply."
    ],
    "tags": [
      "checking"
    ]
  },
  {
    "slug": "summit-credit-union-150-example",
    "title": "Member Checking $150 Offer",
    "provider": "Summit Credit Union",
    "category": "bank-bonuses",
    "offerAmount": "$150",
    "offerType": "Checking bonus",
    "description": "Tracked credit union checking bonus for eligible new members. Membership and offer terms may change.",
    "requirements": [
      "Meet membership eligibility rules.",
      "Open a qualifying checking account.",
      "Complete debit card or deposit activity listed in the offer terms."
    ],
    "fees": [
      "Membership share deposit may be required."
    ],
    "sourceUrl": "https://example.com/summit-member-checking",
    "lastVerified": "2026-05-30",
    "verificationStatus": "verified_this_week",
    "status": "watching",
    "minimumDeposit": "$25 membership share ",
    "monthlyFee": "Verify with credit union",
    "stateRestrictions": [
      "Membership field of eligibility may apply."
    ],
    "riskNotes": [
      "Check membership eligibility before applying."
    ],
    "tags": [
      "credit union",
      "checking"
    ]
  },
  {
    "slug": "metro-trust-savings-100-example",
    "title": "Savings Starter $100 Bonus",
    "provider": "Metro Trust",
    "category": "bank-bonuses",
    "offerAmount": "$100",
    "offerType": "Savings bonus",
    "description": "Tracked savings bonus tied to opening and funding a new account. Always verify current terms before applying.",
    "requirements": [
      "Open an eligible savings account.",
      "Deposit at least the stated minimum new money amount.",
      "Maintain the required balance for the offer period."
    ],
    "fees": [
      "Excess withdrawal or monthly fees may apply."
    ],
    "expirationDate": "2026-09-30",
    "sourceUrl": "https://example.com/metro-trust-savings",
    "lastVerified": "2026-05-29",
    "verificationStatus": "verified_this_week",
    "status": "active",
    "minimumDeposit": "$5,000 new money ",
    "monthlyFee": "$5, waivable",
    "tags": [
      "savings",
      "new money"
    ]
  },
  {
    "slug": "northstar-bank-student-checking-75-example",
    "title": "Student Checking $75 Offer",
    "provider": "Northstar Bank",
    "category": "bank-bonuses",
    "offerAmount": "$75",
    "offerType": "Checking bonus",
    "description": "Tracked student checking promotion with activity requirements. Offer details can vary by campus or region.",
    "requirements": [
      "Open an eligible student checking account.",
      "Complete qualifying debit card activity.",
      "Verify student eligibility if requested."
    ],
    "sourceUrl": "https://example.com/northstar-student-checking",
    "lastVerified": "2026-05-28",
    "verificationStatus": "verified_this_week",
    "status": "active",
    "monthlyFee": "$0 student account ",
    "stateRestrictions": [
      "Campus or region restrictions may apply."
    ],
    "riskNotes": [
      "Confirm age, student, and region requirements."
    ],
    "tags": [
      "student",
      "checking"
    ]
  },
  {
    "slug": "riverbend-priority-checking-500-example",
    "title": "Priority Checking $500 Bonus",
    "provider": "Riverbend Bank",
    "category": "bank-bonuses",
    "offerAmount": "$500",
    "offerType": "Premium checking bonus",
    "description": "Tracked premium checking bonus that may require larger deposits and relationship balances. Verify directly with the provider.",
    "requirements": [
      "Open an eligible premium checking account.",
      "Set up qualifying deposits or relationship balances.",
      "Maintain the required balance through the review period."
    ],
    "fees": [
      "Premium monthly fee may apply unless balance requirements are met."
    ],
    "expirationDate": "2026-06-20",
    "sourceUrl": "https://example.com/riverbend-priority-checking",
    "lastVerified": "2026-05-27",
    "verificationStatus": "needs_review",
    "status": "active",
    "featured": true,
    "requiresDirectDeposit": true,
    "minimumDeposit": "$10,000 relationship balance ",
    "monthlyFee": "$25, waivable",
    "riskNotes": [
      "Check early account closure fees and balance tier rules."
    ],
    "tags": [
      "premium checking",
      "direct deposit"
    ]
  },
  {
    "slug": "axis-invest-600-transfer-example",
    "title": "Investment Transfer Up to $600 Bonus",
    "provider": "Axis Invest",
    "category": "brokerage-bonuses",
    "offerAmount": "Up to $600",
    "offerType": "Brokerage transfer bonus",
    "description": "Tracked tiered brokerage transfer bonus based on eligible new assets. Bonus tiers and holding periods may change.",
    "requirements": [
      "Open or use an eligible brokerage account.",
      "Transfer qualifying new assets by the deadline.",
      "Maintain assets for the required holding period."
    ],
    "fees": [
      "Outgoing transfer or account closure fees may apply."
    ],
    "expirationDate": "2026-10-31",
    "sourceUrl": "https://example.com/axis-invest-transfer",
    "lastVerified": "2026-06-01",
    "verificationStatus": "verified_today",
    "status": "active",
    "featured": true,
    "minimumDeposit": "$25,000 transferred assets ",
    "riskNotes": [
      "Review market risk and transfer fee reimbursement terms."
    ],
    "tags": [
      "brokerage",
      "asset transfer"
    ]
  },
  {
    "slug": "clearpath-brokerage-100-example",
    "title": "New Brokerage Account $100 Offer",
    "provider": "ClearPath Brokerage",
    "category": "brokerage-bonuses",
    "offerAmount": "$100",
    "offerType": "New account bonus",
    "description": "Tracked bonus for funding a new taxable brokerage account. Verify account type eligibility and funding requirements.",
    "requirements": [
      "Open a qualifying brokerage account.",
      "Fund with eligible new money.",
      "Keep the qualifying balance for the offer period."
    ],
    "sourceUrl": "https://example.com/clearpath-brokerage",
    "lastVerified": "2026-05-31",
    "verificationStatus": "verified_this_week",
    "status": "active",
    "minimumDeposit": "$5,000 new money ",
    "tags": [
      "brokerage",
      "new account"
    ]
  },
  {
    "slug": "pioneer-retirement-ira-250-example",
    "title": "IRA Rollover $250 Bonus",
    "provider": "Pioneer Retirement",
    "category": "brokerage-bonuses",
    "offerAmount": "$250",
    "offerType": "IRA rollover bonus",
    "description": "Tracked IRA rollover promotion. Tax considerations and eligibility should be reviewed with the provider or a qualified professional.",
    "requirements": [
      "Open an eligible IRA account.",
      "Complete a qualifying rollover or transfer.",
      "Maintain eligible assets through the bonus period."
    ],
    "fees": [
      "IRA closure, transfer, or investment expense fees may apply."
    ],
    "sourceUrl": "https://example.com/pioneer-ira-rollover",
    "lastVerified": "2026-05-27",
    "verificationStatus": "needs_review",
    "status": "watching",
    "minimumDeposit": "$15,000 rollover ",
    "riskNotes": [
      "Verify rollover rules, taxes, and investment risks."
    ],
    "tags": [
      "ira",
      "retirement"
    ]
  },
  {
    "slug": "nova-trade-free-stock-example",
    "title": "Free Stock Referral Offer",
    "provider": "NovaTrade",
    "category": "brokerage-bonuses",
    "offerAmount": "Variable stock value",
    "offerType": "Referral bonus",